{
  "schema_version": 1,
  "finding_id": "finding.3f2a9c",
  "scan_id": "scan.2026-09-22.1",
  "rule_id": "process.ssh.running",
  "rule_version": 1,
  "observed_at_unix_ms": 1790000000000,
  "severity": "medium",
  "confidence": 100,
  "message": "An SSH server process was observed",
  "evidence": [
    "process.names"
  ],
  "detection": {
    "rule_set_version": 1,
    "preimage_sha256": "aaaaaaaaaaaaaaaaaaaaaaaaaaaaaaaaaaaaaaaaaaaaaaaaaaaaaaaaaaaaaaaa",
    "inputs": [
      {
        "key": "port.tcp.exposed",
        "status": "summarized",
        "item_count": 3
      }
    ],
    "steps": [
      {
        "expression": "(\"2375\" in facts[\"port.tcp.exposed\"])",
        "result": true
      }
    ],
    "truncated": false
  }
}
